{
  "$schema": "https://json-schema.org/draft/2020-12/schema",
  "$id": "https://raw.githubusercontent.com/Sean2603/clinical-decision-assessments/main/schema/assessment-schema.json",
  "title": "Clinical Assessment Guide",
  "type": "object",
  "additionalProperties": false,
  "required": [
    "id",
    "title",
    "version",
    "summary",
    "status",
    "sections",
    "references"
  ],
  "properties": {
    "id": {
      "type": "string",
      "pattern": "^[a-z0-9]+(?:-[a-z0-9]+)*$"
    },
    "title": {
      "type": "string",
      "minLength": 1
    },
    "version": {
      "type": "string",
      "pattern": "^\\d+\\.\\d+\\.\\d+$"
    },
    "summary": {
      "type": "string",
      "minLength": 1
    },
    "lastReviewed": {
      "type": "string",
      "format": "date"
    },
    "sections": {
      "type": "array",
      "minItems": 1,
      "items": {
        "$ref": "#/$defs/section"
      }
    },
    "references": {
      "type": "array",
      "uniqueItems": true,
      "items": {
        "type": "string",
        "minLength": 1
      }
    },
    "clinicalValidation": {
      "type": "object",
      "additionalProperties": false,
      "required": [
        "validated"
      ],
      "properties": {
        "validated": {
          "type": "boolean"
        },
        "reviewedBy": {
          "type": [
            "string",
            "null"
          ]
        },
        "reviewedOn": {
          "type": [
            "string",
            "null"
          ],
          "format": "date"
        },
        "reviewerRole": {
          "type": [
            "string",
            "null"
          ]
        },
        "nextReviewDue": {
          "type": [
            "string",
            "null"
          ],
          "format": "date"
        },
        "reviewNotes": {
          "type": [
            "string",
            "null"
          ]
        }
      }
    },
    "categoryIds": {
      "type": "array",
      "minItems": 1,
      "uniqueItems": true,
      "items": {
        "type": "string",
        "pattern": "^[a-z0-9]+(?:-[a-z0-9]+)*$"
      }
    },
    "status": {
      "type": "string",
      "enum": [
        "active",
        "withdrawn",
        "superseded"
      ]
    },
    "attachments": {
      "type": "array",
      "items": {
        "$ref": "#/$defs/clinicalAttachment"
      },
      "default": []
    },
    "prominentResources": {
      "type": "array",
      "items": {
        "$ref": "#/$defs/prominentResource"
      },
      "default": []
    }
  },
  "$defs": {
    "section": {
      "type": "object",
      "additionalProperties": false,
      "required": [
        "id",
        "title",
        "type",
        "items"
      ],
      "properties": {
        "id": {
          "type": "string",
          "pattern": "^[a-z0-9]+(?:-[a-z0-9]+)*$"
        },
        "title": {
          "type": "string",
          "minLength": 1
        },
        "intro": {
          "type": "string"
        },
        "type": {
          "type": "string",
          "enum": [
            "prompt-list",
            "examination-guide",
            "common-findings",
            "imaging-guidance",
            "safety-netting",
            "reference"
          ]
        },
        "items": {
          "type": "array",
          "minItems": 1,
          "items": {
            "$ref": "#/$defs/item"
          }
        }
      }
    },
    "item": {
      "type": "object",
      "additionalProperties": false,
      "required": [
        "id",
        "title"
      ],
      "properties": {
        "id": {
          "type": "string",
          "pattern": "^[a-z0-9]+(?:-[a-z0-9]+)*$"
        },
        "title": {
          "type": "string",
          "minLength": 1
        },
        "summary": {
          "type": "string"
        },
        "howToTest": {
          "$ref": "#/$defs/stringArray"
        },
        "normal": {
          "$ref": "#/$defs/stringArray"
        },
        "abnormal": {
          "$ref": "#/$defs/stringArray"
        },
        "implications": {
          "$ref": "#/$defs/stringArray"
        },
        "mustConfirmOrExclude": {
          "$ref": "#/$defs/stringArray"
        },
        "commonFindings": {
          "$ref": "#/$defs/stringArray"
        },
        "imagingGuidance": {
          "$ref": "#/$defs/imagingGuidance"
        },
        "urgentFeatures": {
          "$ref": "#/$defs/stringArray"
        },
        "safetyNetting": {
          "$ref": "#/$defs/stringArray"
        },
        "references": {
          "type": "array",
          "uniqueItems": true,
          "items": {
            "type": "string",
            "minLength": 1
          }
        },
        "importantLimitation": {
          "type": "string"
        },
        "localPathwayNote": {
          "type": "string"
        }
      }
    },
    "stringArray": {
      "type": "array",
      "items": {
        "type": "string",
        "minLength": 1
      }
    },
    "imagingGuidance": {
      "type": "object",
      "additionalProperties": false,
      "required": [
        "routineImaging",
        "preferredImaging",
        "urgency",
        "keyTriggers",
        "guidance",
        "references"
      ],
      "properties": {
        "routineImaging": {
          "type": "string",
          "enum": [
            "yes",
            "no",
            "conditional"
          ]
        },
        "preferredImaging": {
          "$ref": "#/$defs/stringArray"
        },
        "urgency": {
          "type": "string",
          "enum": [
            "none",
            "routine",
            "urgent",
            "immediate"
          ]
        },
        "keyTriggers": {
          "$ref": "#/$defs/stringArray"
        },
        "guidance": {
          "$ref": "#/$defs/stringArray"
        },
        "references": {
          "type": "array",
          "uniqueItems": true,
          "items": {
            "type": "string",
            "minLength": 1
          }
        }
      }
    },
    "clinicalAttachmentReplacementGovernance": {
      "type": "object",
      "additionalProperties": false,
      "required": [
        "replacedOn",
        "replacedBy",
        "replacementReason",
        "changeSummary",
        "clinicalMeaningChanged",
        "requiresRevalidation",
        "sourceChecked",
        "previousPath",
        "previousVersion",
        "previousSha256"
      ],
      "properties": {
        "replacedOn": {
          "type": "string",
          "format": "date-time"
        },
        "replacedBy": {
          "type": "string",
          "minLength": 1
        },
        "replacementReason": {
          "type": "string",
          "minLength": 1
        },
        "changeSummary": {
          "type": "string",
          "minLength": 1
        },
        "clinicalMeaningChanged": {
          "type": "boolean"
        },
        "requiresRevalidation": {
          "type": "boolean"
        },
        "sourceChecked": {
          "type": "boolean"
        },
        "previousPath": {
          "type": "string",
          "pattern": "^attachments/"
        },
        "previousVersion": {
          "type": "string",
          "pattern": "^[0-9]+\\.[0-9]+\\.[0-9]+$"
        },
        "previousSha256": {
          "type": "string",
          "pattern": "^[A-Fa-f0-9]{64}$"
        }
      }
    },
    "clinicalAttachment": {
      "type": "object",
      "additionalProperties": false,
      "required": [
        "id",
        "type",
        "title",
        "label",
        "path",
        "caption",
        "source",
        "referenceId",
        "version",
        "sha256",
        "mediaType",
        "originalFileName",
        "fileSize",
        "width",
        "height",
        "uploadedOn",
        "uploadedBy",
        "replacementGovernance"
      ],
      "properties": {
        "id": {
          "type": "string",
          "minLength": 1
        },
        "type": {
          "enum": [
            "image",
            "pdf",
            "document",
            "spreadsheet",
            "presentation",
            "text"
          ]
        },
        "title": {
          "type": "string",
          "minLength": 1
        },
        "label": {
          "type": "string",
          "minLength": 1
        },
        "path": {
          "type": "string",
          "pattern": "^attachments/"
        },
        "caption": {
          "type": [
            "string",
            "null"
          ]
        },
        "source": {
          "type": [
            "string",
            "null"
          ]
        },
        "referenceId": {
          "type": [
            "string",
            "null"
          ]
        },
        "version": {
          "type": "string",
          "pattern": "^[0-9]+\\.[0-9]+\\.[0-9]+$"
        },
        "sha256": {
          "type": "string",
          "pattern": "^[A-Fa-f0-9]{64}$"
        },
        "mediaType": {
          "type": "string",
          "minLength": 1
        },
        "originalFileName": {
          "type": "string",
          "minLength": 1
        },
        "fileSize": {
          "type": [
            "integer",
            "null"
          ],
          "minimum": 0
        },
        "width": {
          "type": [
            "integer",
            "null"
          ],
          "minimum": 1
        },
        "height": {
          "type": [
            "integer",
            "null"
          ],
          "minimum": 1
        },
        "uploadedOn": {
          "type": "string",
          "format": "date-time"
        },
        "uploadedBy": {
          "type": "string",
          "minLength": 1
        },
        "replacementGovernance": {
          "anyOf": [
            {
              "$ref": "#/$defs/clinicalAttachmentReplacementGovernance"
            },
            {
              "type": "null"
            }
          ]
        }
      }
    },
    "prominentResource": {
      "type": "object",
      "additionalProperties": false,
      "required": [
        "label",
        "sourceType"
      ],
      "properties": {
        "label": {
          "type": "string",
          "minLength": 1
        },
        "sourceType": {
          "type": "string",
          "enum": [
            "url",
            "attachment"
          ]
        },
        "url": {
          "type": "string",
          "format": "uri"
        },
        "attachmentId": {
          "type": "string",
          "minLength": 1
        }
      },
      "allOf": [
        {
          "if": {
            "properties": {
              "sourceType": {
                "const": "url"
              }
            },
            "required": [
              "sourceType"
            ]
          },
          "then": {
            "required": [
              "url"
            ]
          }
        },
        {
          "if": {
            "properties": {
              "sourceType": {
                "const": "attachment"
              }
            },
            "required": [
              "sourceType"
            ]
          },
          "then": {
            "required": [
              "attachmentId"
            ]
          }
        }
      ]
    }
  }
}
