{
  "id": "acute-kidney-injury-assessment",
  "title": "Acute Kidney Injury Assessment",
  "version": "0.1.1",
  "summary": "A clinician-facing prompt for recognising acute kidney injury, comparing renal function with baseline, identifying the likely cause, assessing fluid status and complications, and selecting an appropriate monitoring or referral pathway.",
  "sections": [
    {
      "id": "assessment-priorities",
      "title": "Assessment priorities",
      "type": "prompt-list",
      "intro": "Use this guide after immediate ABC concerns have been addressed. Confirm that the creatinine change represents acute kidney injury, identify reversible causes and complications, and determine who can be monitored safely outside hospital.",
      "items": [
        {
          "id": "must-confirm-or-exclude",
          "title": "Must confirm or exclude",
          "mustConfirmOrExclude": [
            "Whether acute kidney injury criteria are met by creatinine change or urine output, rather than interpreting the current eGFR in isolation.",
            "The most reliable previous creatinine, the time between samples and the direction and speed of change.",
            "Oliguria: urine output below 0.5 mL/kg/hour, including duration and whether output has been measured reliably.",
            "Hypovolaemia, sepsis, urinary obstruction, cardiorenal congestion and exposure to kidney-injuring medicines or toxins.",
            "Hyperkalaemia, metabolic acidosis, pulmonary oedema, uraemic complications or other evidence that renal replacement therapy may be required.",
            "Stage 3 acute kidney injury, renal transplant, chronic kidney disease stage 4 or 5, an unclear cause or inadequate response to initial treatment.",
            "A documented monitoring plan, medication plan, responsible clinician and repeat-blood timeframe before community management is selected."
          ],
          "references": [
            "NICE-NG148"
          ],
          "importantLimitation": "A low eGFR during an acute creatinine rise does not accurately describe stable chronic kidney function. Diagnose and stage acute kidney injury from change in creatinine and urine output."
        }
      ]
    },
    {
      "id": "history-prompts",
      "title": "History prompts",
      "type": "prompt-list",
      "intro": "Establish the renal trajectory, likely precipitant, urine output, medication exposure and whether the patient can be monitored safely.",
      "items": [
        {
          "id": "renal-trajectory",
          "title": "Renal trajectory and previous results",
          "mustConfirmOrExclude": [
            "Current creatinine, urea, potassium, bicarbonate, sodium and eGFR.",
            "Previous creatinine values with exact dates, including the most recent stable baseline where available.",
            "Absolute and percentage creatinine change and whether this occurred within 48 hours or 7 days.",
            "Previous acute kidney injury, chronic kidney disease, renal replacement therapy or nephrology follow-up.",
            "Recent discharge, surgery, contrast exposure or an earlier abnormal result that has not been reviewed."
          ],
          "references": [
            "NICE-NG148"
          ]
        },
        {
          "id": "intake-and-losses",
          "title": "Intake, losses and fluid balance",
          "mustConfirmOrExclude": [
            "Reduced oral intake, thirst and ability to access or prepare drinks.",
            "Vomiting, diarrhoea, fever, sweating, bleeding, high stoma output, fistula output or other ongoing losses.",
            "Usual and current urine output, last passed urine, urine colour and whether output has fallen substantially.",
            "Recent weight change and any available fluid-balance record.",
            "Symptoms of fluid overload, including orthopnoea, new breathlessness, rapid weight gain, peripheral oedema or reduced exercise tolerance."
          ],
          "references": [
            "NICE-NG148",
            "NICE-CG174"
          ]
        },
        {
          "id": "urinary-obstruction-history",
          "title": "Urinary and obstruction history",
          "mustConfirmOrExclude": [
            "Difficulty initiating urination, poor stream, incomplete emptying, retention, overflow leakage or suprapubic discomfort.",
            "Anuria, flank pain, renal colic, haematuria or recurrent urinary infection.",
            "Known prostate disease, pelvic malignancy, renal stones, ureteric stent, nephrostomy or urinary diversion.",
            "Catheter patency, bypassing, blockage, reduced drainage or recent catheter change.",
            "Solitary kidney, renal transplant or previous obstructive uropathy."
          ],
          "references": [
            "NICE-NG148"
          ]
        },
        {
          "id": "infection-and-systemic-disease",
          "title": "Infection and systemic disease",
          "mustConfirmOrExclude": [
            "Fever, rigors, respiratory symptoms, urinary symptoms, skin infection, abdominal symptoms or another possible infection source.",
            "Recent hypotension, sepsis, severe illness or deteriorating early warning score.",
            "Rash, joint symptoms, sinus symptoms, haemoptysis or other features suggesting vasculitis or multisystem disease.",
            "Oedema, frothy urine or visible haematuria suggesting glomerular disease.",
            "Recent muscle injury, prolonged immobilisation, seizures or dark urine suggesting rhabdomyolysis."
          ],
          "references": [
            "NICE-NG148"
          ]
        },
        {
          "id": "medicines-and-toxins",
          "title": "Medicines and nephrotoxic exposure",
          "mustConfirmOrExclude": [
            "NSAIDs, ACE inhibitors, ARBs, diuretics, aminoglycosides and other medicines that can cause or worsen kidney injury.",
            "Trimethoprim, lithium, digoxin, metformin, SGLT2 inhibitors, anticoagulants and other medicines whose safety or dosing changes with renal impairment.",
            "Recent antimicrobial treatment, dose, duration and susceptibility results where relevant.",
            "Iodine-based contrast exposure within the previous week.",
            "Over-the-counter medicines, herbal products, recreational drugs or possible overdose.",
            "Any medicine withheld already and who authorised the change."
          ],
          "references": [
            "NICE-NG148"
          ]
        },
        {
          "id": "comorbidity-and-community-safety",
          "title": "Comorbidity and community safety",
          "mustConfirmOrExclude": [
            "Heart failure, liver disease, diabetes, vascular disease, malignancy or chronic kidney disease.",
            "Age 65 years or over, frailty, cognitive impairment or dependence on carers for fluids and medicines.",
            "Baseline mobility, current functional decline and ability to attend repeat blood tests.",
            "Availability of a responsible clinician to review results and act on deterioration.",
            "Treatment escalation plan, advance decisions and goals of care where relevant."
          ],
          "references": [
            "NICE-NG148"
          ]
        }
      ]
    },
    {
      "id": "serious-pathology-screen",
      "title": "Complication and urgent-cause screen",
      "type": "prompt-list",
      "intro": "Positive findings should change disposition and trigger the appropriate acute, renal, urology or local escalation pathway.",
      "items": [
        {
          "id": "hyperkalaemia",
          "title": "Hyperkalaemia",
          "urgentFeatures": [
            "Potassium at a locally defined urgent threshold, a rapidly rising potassium or a result accompanied by weakness, bradycardia, palpitations or syncope.",
            "ECG abnormalities compatible with hyperkalaemia.",
            "Persistent hyperkalaemia despite initial management."
          ],
          "implications": [
            "Requires immediate clinical review and management through the relevant JRCALC or hospital hyperkalaemia pathway."
          ],
          "references": [
            "NICE-NG148"
          ],
          "importantLimitation": "A normal ECG does not exclude clinically important hyperkalaemia, and a haemolysed sample should be repeated urgently when the clinical risk is significant."
        },
        {
          "id": "fluid-overload",
          "title": "Fluid overload or pulmonary oedema",
          "urgentFeatures": [
            "New oxygen requirement, respiratory distress, orthopnoea or widespread crackles.",
            "Rapidly increasing oedema or weight with oliguria.",
            "Fluid overload that is not responding to medical management."
          ],
          "implications": [
            "Possible indication for urgent renal or critical-care discussion, particularly when pulmonary oedema does not respond to treatment."
          ],
          "references": [
            "NICE-NG148"
          ]
        },
        {
          "id": "acidosis-or-uraemia",
          "title": "Metabolic acidosis or uraemic complications",
          "urgentFeatures": [
            "Severe or worsening metabolic acidosis.",
            "Encephalopathy, pericarditic chest pain, unexplained bleeding, persistent vomiting or other suspected uraemic complications.",
            "Complications not responding to medical management."
          ],
          "implications": [
            "Discuss possible renal replacement therapy immediately with nephrology or critical care."
          ],
          "references": [
            "NICE-NG148"
          ]
        },
        {
          "id": "obstruction-or-pyonephrosis",
          "title": "Urinary obstruction or pyonephrosis",
          "urgentFeatures": [